score,content,Label,text_clean,text_StopWord,text_tokens,text_steamindo
2,"Kenapa pelayanan shoppe express sekarang jadi begini, paket saya yang reguler terlambat sampai, ini paket saya yang drop point begitu juga melebihi estimasi dan itu bukan 1-2 hari saja keterlambatannya bahkan hampir satu Minggu, saya mengisi formulir percepatan tidak ada balasan.😒",Negatif,kenapa pelayanan shoppe express sekarang jadi begini paket saya yang reguler terlambat sampai ini paket saya yang drop point begitu juga melebihi estimasi dan itu bukan  hari saja keterlambatannya bahkan hampir satu minggu saya mengisi formulir percepatan tidak ada balasan,pelayanan shoppe express paket reguler terlambat paket drop point melebihi estimasi keterlambatannya minggu mengisi formulir percepatan balasan,"['pelayanan', 'shoppe', 'express', 'paket', 'reguler', 'terlambat', 'paket', 'drop', 'point', 'melebihi', 'estimasi', 'keterlambatannya', 'minggu', 'mengisi', 'formulir', 'percepatan', 'balasan']",layan shoppe express paket reguler lambat paket drop point lebih estimasi lambat minggu isi formulir cepat balas
4,"Dengan berat hati, terpaksa dari bintang 5 jadi bintang 1, Pertama. Masalah jasa kirim yg sekarang tidak bisa di pilih, kedua Spaylater sekarang bayar bln depan aja bunganya tambah mahal..yg ketiga sangat lelet aplikasinya..lemot, berat..yg ke empat pesan di chat numpuk karna tidak bisa dikosongkan semua.,repot pokoknya",Positif,dengan berat hati terpaksa dari bintang  jadi bintang  pertama masalah jasa kirim yg sekarang tidak bisa di pilih kedua spaylater sekarang bayar bln depan aja bunganya tambah mahalyg ketiga sangat lelet aplikasinyalemot beratyg ke empat pesan di chat numpuk karna tidak bisa dikosongkan semuarepot pokoknya,berat hati terpaksa bintang bintang jasa kirim yg pilih spaylater bayar bln aja bunganya mahalyg ketiga lelet aplikasinyalemot beratyg pesan chat numpuk karna dikosongkan semuarepot pokoknya,"['berat', 'hati', 'terpaksa', 'bintang', 'bintang', 'jasa', 'kirim', 'yg', 'pilih', 'spaylater', 'bayar', 'bln', 'aja', 'bunganya', 'mahalyg', 'ketiga', 'lelet', 'aplikasinyalemot', 'beratyg', 'pesan', 'chat', 'numpuk', 'karna', 'dikosongkan', 'semuarepot', 'pokoknya']",berat hati paksa bintang bintang jasa kirim yg pilih spaylater bayar bln aja bunga mahalyg tiga lelet aplikasinyalemot beratyg pesan chat numpuk karna kosong semuarepot pokok
1,"Gausa banyakin sopi game lah atau fitur ga guna lain nya mending bagusin dulu apk nya sering lemot karena keberatan fitur ga guna. Oya sekalian balikin tampilan sopi yang dulu, yg sekarang jelek banget tamipilan nya ngikut kyk tiktkshp padahal bagusan yang dulu",Negatif,gausa banyakin sopi game lah atau fitur ga guna lain nya mending bagusin dulu apk nya sering lemot karena keberatan fitur ga guna oya sekalian balikin tampilan sopi yang dulu yg sekarang jelek banget tamipilan nya ngikut kyk tiktkshp padahal bagusan yang dulu,gausa banyakin sopi game fitur ga nya mending bagusin apk nya lemot keberatan fitur ga oya balikin tampilan sopi yg jelek banget tamipilan nya ngikut kyk tiktkshp bagusan,"['gausa', 'banyakin', 'sopi', 'game', 'fitur', 'ga', 'nya', 'mending', 'bagusin', 'apk', 'nya', 'lemot', 'keberatan', 'fitur', 'ga', 'oya', 'balikin', 'tampilan', 'sopi', 'yg', 'jelek', 'banget', 'tamipilan', 'nya', 'ngikut', 'kyk', 'tiktkshp', 'bagusan']",gausa banyakin sopi game fitur ga nya mending bagusin apk nya lot berat fitur ga oya balikin tampil sopi yg jelek banget tamipilan nya ngikut kyk tiktkshp bagus
2,"Tolong di perbaiki lagi sistem nya, setelah di update mau mencet tombol back susah banget jadi setiap mau di back harus di close paksa lalu buka shopee dari awal lagi dan cari toko atau shopee live nya lagi.",Negatif,tolong di perbaiki lagi sistem nya setelah di update mau mencet tombol back susah banget jadi setiap mau di back harus di close paksa lalu buka shopee dari awal lagi dan cari toko atau shopee live nya lagi,tolong perbaiki sistem nya update mencet tombol back susah banget back close paksa buka shopee cari toko shopee live nya,"['tolong', 'perbaiki', 'sistem', 'nya', 'update', 'mencet', 'tombol', 'back', 'susah', 'banget', 'back', 'close', 'paksa', 'buka', 'shopee', 'cari', 'toko', 'shopee', 'live', 'nya']",tolong baik sistem nya update mencet tombol back susah banget back close paksa buka shopee cari toko shopee live nya
1,"Kebijakan dalam return barang sangat merugikan reseller apalagi yang menjual produk bekas, sebagai reseller sudah menjual dengan sejujur-jujurnya terkait barsng yang dijual termasuk menyampaikan MINUSnya, ketika barang yang dijual sudah ada yg mengefixkan artinya transaksi jual beli syah dengan kondisi barang yang dibeli. Dengan kebijan return yang sangat mudah membuat menguntungkan pembeli ketika barang yang dibeli sampai dan ternyata tidak sesuai dengan keinginan hati,SALAM WARAS",Negatif,kebijakan dalam return barang sangat merugikan reseller apalagi yang menjual produk bekas sebagai reseller sudah menjual dengan sejujurjujurnya terkait barsng yang dijual termasuk menyampaikan minusnya ketika barang yang dijual sudah ada yg mengefixkan artinya transaksi jual beli syah dengan kondisi barang yang dibeli dengan kebijan return yang sangat mudah membuat menguntungkan pembeli ketika barang yang dibeli sampai dan ternyata tidak sesuai dengan keinginan hatisalam waras,kebijakan return barang merugikan reseller menjual produk bekas reseller menjual sejujurjujurnya terkait barsng dijual minusnya barang dijual yg mengefixkan transaksi jual beli syah kondisi barang dibeli kebijan return mudah menguntungkan pembeli barang dibeli sesuai hatisalam waras,"['kebijakan', 'return', 'barang', 'merugikan', 'reseller', 'menjual', 'produk', 'bekas', 'reseller', 'menjual', 'sejujurjujurnya', 'terkait', 'barsng', 'dijual', 'minusnya', 'barang', 'dijual', 'yg', 'mengefixkan', 'transaksi', 'jual', 'beli', 'syah', 'kondisi', 'barang', 'dibeli', 'kebijan', 'return', 'mudah', 'menguntungkan', 'pembeli', 'barang', 'dibeli', 'sesuai', 'hatisalam', 'waras']",bijak return barang rugi reseller jual produk bekas reseller jual sejujurjujurnya kait barsng jual minus barang jual yg mengefixkan transaksi jual beli syah kondisi barang beli bijan return mudah untung beli barang beli sesuai hatisalam waras
1,Terlalu lambat pengiriman nya Kalau ngga bisa layani customer dengan baik hapus aja tuh aplikasi shopee mu masih banyak kok tempat blanja online yg pengiriman nya lebih cepat. Bilangnya di terima tgl sekian tpi pas datang nya 10 hari kemudian bangke lah Kalau blm pasti bisa cepat jangan PHP in customer (PAHAM),Negatif,terlalu lambat pengiriman nya kalau ngga bisa layani customer dengan baik hapus aja tuh aplikasi shopee mu masih banyak kok tempat blanja online yg pengiriman nya lebih cepat bilangnya di terima tgl sekian tpi pas datang nya  hari kemudian bangke lah kalau blm pasti bisa cepat jangan php in customer paham,lambat pengiriman nya ngga layani customer hapus aja tuh aplikasi shopee mu blanja online yg pengiriman nya cepat bilangnya terima tgl sekian tpi pas nya bangke blm cepat php in customer paham,"['lambat', 'pengiriman', 'nya', 'ngga', 'layani', 'customer', 'hapus', 'aja', 'tuh', 'aplikasi', 'shopee', 'mu', 'blanja', 'online', 'yg', 'pengiriman', 'nya', 'cepat', 'bilangnya', 'terima', 'tgl', 'sekian', 'tpi', 'pas', 'nya', 'bangke', 'blm', 'cepat', 'php', 'in', 'customer', 'paham']",lambat kirim nya ngga layan customer hapus aja tuh aplikasi shopee mu blanja online yg kirim nya cepat bilang terima tgl sekian tpi pas nya bangke blm cepat php in customer paham
5,"Aplikasi yg bagus buat belanja online, saya sudah lama berlangganan di sini alhamdullilah gak pernah kecewa, barang sesuai yg di harapkan.. Mudah2an kedepan bisa menjadi yang terdepan.😘😘😘😘 Semoga yg berjualan di Shopee tatap mempertahankan barang2 yg bagus biar yg belanja jangan sampai kapok dan mengecewakan pelanggan yang berbelanja di Shopee,",Positif,aplikasi yg bagus buat belanja online saya sudah lama berlangganan di sini alhamdullilah gak pernah kecewa barang sesuai yg di harapkan mudahan kedepan bisa menjadi yang terdepan semoga yg berjualan di shopee tatap mempertahankan barang yg bagus biar yg belanja jangan sampai kapok dan mengecewakan pelanggan yang berbelanja di shopee,aplikasi yg bagus belanja online berlangganan alhamdullilah gak kecewa barang sesuai yg harapkan mudahan kedepan terdepan semoga yg berjualan shopee tatap mempertahankan barang yg bagus biar yg belanja kapok mengecewakan pelanggan berbelanja shopee,"['aplikasi', 'yg', 'bagus', 'belanja', 'online', 'berlangganan', 'alhamdullilah', 'gak', 'kecewa', 'barang', 'sesuai', 'yg', 'harapkan', 'mudahan', 'kedepan', 'terdepan', 'semoga', 'yg', 'berjualan', 'shopee', 'tatap', 'mempertahankan', 'barang', 'yg', 'bagus', 'biar', 'yg', 'belanja', 'kapok', 'mengecewakan', 'pelanggan', 'berbelanja', 'shopee']",aplikasi yg bagus belanja online langgan alhamdullilah gak kecewa barang sesuai yg harap mudah depan depan moga yg jual shopee tatap tahan barang yg bagus biar yg belanja kapok kecewa langgan belanja shopee
2,"Telat dalam menangani masalah, saya sbg penjual barang yg sudah dikirim masih dalam status pengiriman nggak rubah2 sampe 4hari padahal pembeli sudah chat dan konfirmasi pesanan telah selesai. Sudah hubungi agen shopee tetep aja",Negatif,telat dalam menangani masalah saya sbg penjual barang yg sudah dikirim masih dalam status pengiriman nggak rubah sampe hari padahal pembeli sudah chat dan konfirmasi pesanan telah selesai sudah hubungi agen shopee tetep aja,telat menangani sbg penjual barang yg dikirim status pengiriman nggak rubah sampe pembeli chat konfirmasi pesanan selesai hubungi agen shopee tetep aja,"['telat', 'menangani', 'sbg', 'penjual', 'barang', 'yg', 'dikirim', 'status', 'pengiriman', 'nggak', 'rubah', 'sampe', 'pembeli', 'chat', 'konfirmasi', 'pesanan', 'selesai', 'hubungi', 'agen', 'shopee', 'tetep', 'aja']",telat tangan sbg jual barang yg kirim status kirim nggak rubah sampe beli chat konfirmasi pesan selesai hubung agen shopee tetep aja
5,Saya hanya melakukan transaksi dengan Shopee.. Karena selama ini belum pernah mengecewakan saya.. Dari barang yang sesuai dengan promo atau iklannya juga dalam hal kurirnya yang saya kenal ramah ramah.. SSS... Shopee sukses selalu😊😊😊🥰,Positif,saya hanya melakukan transaksi dengan shopee karena selama ini belum pernah mengecewakan saya dari barang yang sesuai dengan promo atau iklannya juga dalam hal kurirnya yang saya kenal ramah ramah sss shopee sukses selalu,transaksi shopee mengecewakan barang sesuai promo iklannya kurirnya kenal ramah ramah sss shopee sukses,"['transaksi', 'shopee', 'mengecewakan', 'barang', 'sesuai', 'promo', 'iklannya', 'kurirnya', 'kenal', 'ramah', 'ramah', 'sss', 'shopee', 'sukses']",transaksi shopee kecewa barang sesuai promo iklan kurir kenal ramah ramah sss shopee sukses
2,"Sblm update gda kendala, sempet kasih bintang 5 malah,, tp maaf setelah update, jd banyak kendala, Saat buka live sering kluar sndiri, ga bisa tekan beberapa tombol hp, serasa pake hp ram kcil, lemot,. Tapi pake aplikasi lain lancar jaya. Mohon perbaiki kekurangan di updatetan skrg. Lebar nama atuh gaes, Hampura bintangnya di sisain 2 aja.",Negatif,sblm update gda kendala sempet kasih bintang  malah tp maaf setelah update jd banyak kendala saat buka live sering kluar sndiri ga bisa tekan beberapa tombol hp serasa pake hp ram kcil lemot tapi pake aplikasi lain lancar jaya mohon perbaiki kekurangan di updatetan skrg lebar nama atuh gaes hampura bintangnya di sisain  aja,sblm update gda kendala sempet kasih bintang tp maaf update jd kendala buka live kluar sndiri ga tekan tombol hp serasa pake hp ram kcil lemot pake aplikasi lancar jaya mohon perbaiki kekurangan updatetan skrg lebar nama atuh gaes hampura bintangnya sisain aja,"['sblm', 'update', 'gda', 'kendala', 'sempet', 'kasih', 'bintang', 'tp', 'maaf', 'update', 'jd', 'kendala', 'buka', 'live', 'kluar', 'sndiri', 'ga', 'tekan', 'tombol', 'hp', 'serasa', 'pake', 'hp', 'ram', 'kcil', 'lemot', 'pake', 'aplikasi', 'lancar', 'jaya', 'mohon', 'perbaiki', 'kekurangan', 'updatetan', 'skrg', 'lebar', 'nama', 'atuh', 'gaes', 'hampura', 'bintangnya', 'sisain', 'aja']",sblm update gda kendala sempet kasih bintang tp maaf update jd kendala buka live kluar sndiri ga tekan tombol hp serasa pake hp ram kcil lot pake aplikasi lancar jaya mohon baik kurang updatetan skrg lebar nama atuh gaes hampura bintang sisain aja
2,Super lemot.... Aplikasi nya ambisi bangt.. kebyakan fitur.. tapi servernya down terus.... Lebih cepat server lazada... Kalau shopei bnyk problemnya.. makin parah... Lain lagi live streaming penjual yg suka nongol... Ahhh ... Ini bikin tambah berat...,Negatif,super lemot aplikasi nya ambisi bangt kebyakan fitur tapi servernya down terus lebih cepat server lazada kalau shopei bnyk problemnya makin parah lain lagi live streaming penjual yg suka nongol ahhh  ini bikin tambah berat,super lemot aplikasi nya ambisi bangt kebyakan fitur servernya down cepat server lazada shopei bnyk problemnya parah live streaming penjual yg suka nongol ahhh bikin berat,"['super', 'lemot', 'aplikasi', 'nya', 'ambisi', 'bangt', 'kebyakan', 'fitur', 'servernya', 'down', 'cepat', 'server', 'lazada', 'shopei', 'bnyk', 'problemnya', 'parah', 'live', 'streaming', 'penjual', 'yg', 'suka', 'nongol', 'ahhh', 'bikin', 'berat']",super lot aplikasi nya ambisi bangt kebyakan fitur servernya down cepat server lazada shopei bnyk problem parah live streaming jual yg suka nongol ahhh bikin berat
1,"Saya rasa Expedisi SPX gak usah lagi join di Shopee, biar JNT & JNE atau yg lainnya, karena buruk sekali pelayanan dalam hal kecepatan Pengirimannya, khusus nya ke Area Kaltim tempat saya yg termasuk di tengah Kota Samarinda.. selalu kalo pake Expedisi SPX, harus memakan waktu bisa sampe 2 minggu, dengan kendala ini dan itu.. sementara kalo menggunakan Expedisi lain, gak segitunya waktu yg diperlukan, kan aneh.??",Negatif,saya rasa expedisi spx gak usah lagi join di shopee biar jnt  jne atau yg lainnya karena buruk sekali pelayanan dalam hal kecepatan pengirimannya khusus nya ke area kaltim tempat saya yg termasuk di tengah kota samarinda selalu kalo pake expedisi spx harus memakan waktu bisa sampe  minggu dengan kendala ini dan itu sementara kalo menggunakan expedisi lain gak segitunya waktu yg diperlukan kan aneh,expedisi spx gak join shopee biar jnt jne yg buruk pelayanan kecepatan pengirimannya khusus nya area kaltim yg kota samarinda kalo pake expedisi spx memakan sampe minggu kendala kalo expedisi gak segitunya yg aneh,"['expedisi', 'spx', 'gak', 'join', 'shopee', 'biar', 'jnt', 'jne', 'yg', 'buruk', 'pelayanan', 'kecepatan', 'pengirimannya', 'khusus', 'nya', 'area', 'kaltim', 'yg', 'kota', 'samarinda', 'kalo', 'pake', 'expedisi', 'spx', 'memakan', 'sampe', 'minggu', 'kendala', 'kalo', 'expedisi', 'gak', 'segitunya', 'yg', 'aneh']",expedisi spx gak join shopee biar jnt jne yg buruk layan cepat kirim khusus nya area kaltim yg kota samarinda kalo pake expedisi spx makan sampe minggu kendala kalo expedisi gak segitunya yg aneh
1,"Gausah kasih program bebas pengembalian. Kalian tau gak kami pembeli secara cod sudah berkali kali pesan barang belum di kirim sama kurir udah di kembalikan ke penjual. Ini sudah terjadi berkali kali . Saya hubungi CS katanya alasan alamat tdk sesuai /3 kali kurir telah mencoba kirim padahal tidak di kirim . Kurir jadi tidak amanah karena bebas di kembalikan tanpa ada sanksi barang banyak yang tidak sampai di pembeli. Kecewa akhir"" ini dengan shopee. Kasian juga penjualnya banyak barang tertolak",Negatif,gausah kasih program bebas pengembalian kalian tau gak kami pembeli secara cod sudah berkali kali pesan barang belum di kirim sama kurir udah di kembalikan ke penjual ini sudah terjadi berkali kali  saya hubungi cs katanya alasan alamat tdk sesuai  kali kurir telah mencoba kirim padahal tidak di kirim  kurir jadi tidak amanah karena bebas di kembalikan tanpa ada sanksi barang banyak yang tidak sampai di pembeli kecewa akhir ini dengan shopee kasian juga penjualnya banyak barang tertolak,gausah kasih program bebas pengembalian tau gak pembeli cod berkali kali pesan barang kirim kurir udah kembalikan penjual berkali kali hubungi cs alasan alamat tdk sesuai kali kurir mencoba kirim kirim kurir amanah bebas kembalikan sanksi barang pembeli kecewa shopee kasian penjualnya barang tertolak,"['gausah', 'kasih', 'program', 'bebas', 'pengembalian', 'tau', 'gak', 'pembeli', 'cod', 'berkali', 'kali', 'pesan', 'barang', 'kirim', 'kurir', 'udah', 'kembalikan', 'penjual', 'berkali', 'kali', 'hubungi', 'cs', 'alasan', 'alamat', 'tdk', 'sesuai', 'kali', 'kurir', 'mencoba', 'kirim', 'kirim', 'kurir', 'amanah', 'bebas', 'kembalikan', 'sanksi', 'barang', 'pembeli', 'kecewa', 'shopee', 'kasian', 'penjualnya', 'barang', 'tertolak']",gausah kasih program bebas kembali tau gak beli cod kali kali pesan barang kirim kurir udah kembali jual kali kali hubung cs alas alamat tdk sesuai kali kurir coba kirim kirim kurir amanah bebas kembali sanksi barang beli kecewa shopee kasi jual barang tolak
1,Sangat kecewa belanja barang trus dikembalikan kepada penjual.. bekerjasama lah dengan jasa pengiriman yg profesional !!! Jgn menyediakan jasa pengiriman yg tidak konsisten dengan alasan diluar jangkauan jasa kurir !! Seharusnya dari awal sebelum di check out diberitahukan Sangat kecewa dgn spx express sidikalang!!,Negatif,sangat kecewa belanja barang trus dikembalikan kepada penjual bekerjasama lah dengan jasa pengiriman yg profesional  jgn menyediakan jasa pengiriman yg tidak konsisten dengan alasan diluar jangkauan jasa kurir  seharusnya dari awal sebelum di check out diberitahukan sangat kecewa dgn spx express sidikalang,kecewa belanja barang trus dikembalikan penjual bekerjasama jasa pengiriman yg profesional jgn menyediakan jasa pengiriman yg konsisten alasan diluar jangkauan jasa kurir check out diberitahukan kecewa dgn spx express sidikalang,"['kecewa', 'belanja', 'barang', 'trus', 'dikembalikan', 'penjual', 'bekerjasama', 'jasa', 'pengiriman', 'yg', 'profesional', 'jgn', 'menyediakan', 'jasa', 'pengiriman', 'yg', 'konsisten', 'alasan', 'diluar', 'jangkauan', 'jasa', 'kurir', 'check', 'out', 'diberitahukan', 'kecewa', 'dgn', 'spx', 'express', 'sidikalang']",kecewa belanja barang trus kembali jual bekerjasama jasa kirim yg profesional jgn sedia jasa kirim yg konsisten alas luar jangkau jasa kurir check out diberitahukan kecewa dgn spx express sidikalang
4,"Kak kenapa beberapa hari ini shoppe saya tidak bisa untuk ligat live, kalo mau beri penalaian di shoppe nya juga gak bisa pas saya mau upload video sama poto pasti gak bisa, live nya itu kak yang menurut saya paling penting untuk segera diperbaiki, mohon di cek akun saya ya kaakkkk, nanti kalau sudah ad perbaikan bintangnya saya tambah, sebenernya udah suka banget sama shoppe gak bisa move on tapi ya ad kendala akhir"" ini jadi agak susah make shoppe nya, semangat yaaa",Positif,kak kenapa beberapa hari ini shoppe saya tidak bisa untuk ligat live kalo mau beri penalaian di shoppe nya juga gak bisa pas saya mau upload video sama poto pasti gak bisa live nya itu kak yang menurut saya paling penting untuk segera diperbaiki mohon di cek akun saya ya kaakkkk nanti kalau sudah ad perbaikan bintangnya saya tambah sebenernya udah suka banget sama shoppe gak bisa move on tapi ya ad kendala akhir ini jadi agak susah make shoppe nya semangat yaaa,kak shoppe ligat live kalo penalaian shoppe nya gak pas upload video poto gak live nya kak diperbaiki mohon cek akun ya kaakkkk ad perbaikan bintangnya sebenernya udah suka banget shoppe gak move on ya ad kendala susah make shoppe nya semangat yaaa,"['kak', 'shoppe', 'ligat', 'live', 'kalo', 'penalaian', 'shoppe', 'nya', 'gak', 'pas', 'upload', 'video', 'poto', 'gak', 'live', 'nya', 'kak', 'diperbaiki', 'mohon', 'cek', 'akun', 'ya', 'kaakkkk', 'ad', 'perbaikan', 'bintangnya', 'sebenernya', 'udah', 'suka', 'banget', 'shoppe', 'gak', 'move', 'on', 'ya', 'ad', 'kendala', 'susah', 'make', 'shoppe', 'nya', 'semangat', 'yaaa']",kak shoppe ligat live kalo penalaian shoppe nya gak pas upload video poto gak live nya kak baik mohon cek akun ya kaakkkk ad baik bintang sebenernya udah suka banget shoppe gak move on ya ad kendala susah make shoppe nya semangat yaaa
5,Ada saran dikit kenapa setiap pesan barang tulisannya barang selesai... Padahal barang blm di Terima.. Tar besoknya berubah lg tulisannya jadi merah TERIMA PESAN kadan rubah sendiri.. Apakah mungkin dari sistemnya?.. Itu aja sih sarannya,Positif,ada saran dikit kenapa setiap pesan barang tulisannya barang selesai padahal barang blm di terima tar besoknya berubah lg tulisannya jadi merah terima pesan kadan rubah sendiri apakah mungkin dari sistemnya itu aja sih sarannya,saran dikit pesan barang tulisannya barang selesai barang blm terima tar besoknya berubah lg tulisannya merah terima pesan kadan rubah sistemnya aja sih sarannya,"['saran', 'dikit', 'pesan', 'barang', 'tulisannya', 'barang', 'selesai', 'barang', 'blm', 'terima', 'tar', 'besoknya', 'berubah', 'lg', 'tulisannya', 'merah', 'terima', 'pesan', 'kadan', 'rubah', 'sistemnya', 'aja', 'sih', 'sarannya']",saran dikit pesan barang tulis barang selesai barang blm terima tar besok ubah lg tulis merah terima pesan kad rubah sistem aja sih saran
4,Aplikasi Shopee ini pilihannya banyak dan bagus bagus. Barang nya terkadang murah banget sampai semua keinginan kebeli. Yuk gais semuanya buruan download Shopee utk berbelanja lbh mudah 😎❤🥰,Positif,aplikasi shopee ini pilihannya banyak dan bagus bagus barang nya terkadang murah banget sampai semua keinginan kebeli yuk gais semuanya buruan download shopee utk berbelanja lbh mudah ,aplikasi shopee pilihannya bagus bagus barang nya terkadang murah banget kebeli yuk gais buruan download shopee utk berbelanja lbh mudah,"['aplikasi', 'shopee', 'pilihannya', 'bagus', 'bagus', 'barang', 'nya', 'terkadang', 'murah', 'banget', 'kebeli', 'yuk', 'gais', 'buruan', 'download', 'shopee', 'utk', 'berbelanja', 'lbh', 'mudah']",aplikasi shopee pilih bagus bagus barang nya terkadang murah banget kebel yuk gais buru download shopee utk belanja lbh mudah
1,"22 maret fitur pencarian tidak berfungsi , hasil pencarian selalu gagal dan coba lagi , padahal sinyal pkai data bagus ,pakai wifi juga bagus , tapi tetap gagal , ini murni bug dari shopee",Negatif, maret fitur pencarian tidak berfungsi  hasil pencarian selalu gagal dan coba lagi  padahal sinyal pkai data bagus pakai wifi juga bagus  tapi tetap gagal  ini murni bug dari shopee,maret fitur pencarian berfungsi hasil pencarian gagal coba sinyal pkai data bagus pakai wifi bagus gagal murni bug shopee,"['maret', 'fitur', 'pencarian', 'berfungsi', 'hasil', 'pencarian', 'gagal', 'coba', 'sinyal', 'pkai', 'data', 'bagus', 'pakai', 'wifi', 'bagus', 'gagal', 'murni', 'bug', 'shopee']",maret fitur cari fungsi hasil cari gagal coba sinyal pkai data bagus pakai wifi bagus gagal murni bug shopee
2,"Awal nya saya kasih bintang lima, karena emg ga ada hambatan sama sekali. Tetapi semenjak Shopee update pengiriman menjadi sangat lama, yang biasa hanya 3-4 hari menjadi hampir seminggu lebih,sedikit kecewa . Saya kurangi 3 bintang ya. Kalau semua sudah diperbaiki saya bakalan kasih bintang 5👍",Negatif,awal nya saya kasih bintang lima karena emg ga ada hambatan sama sekali tetapi semenjak shopee update pengiriman menjadi sangat lama yang biasa hanya  hari menjadi hampir seminggu lebihsedikit kecewa  saya kurangi  bintang ya kalau semua sudah diperbaiki saya bakalan kasih bintang ,nya kasih bintang emg ga hambatan semenjak shopee update pengiriman seminggu lebihsedikit kecewa kurangi bintang ya diperbaiki kasih bintang,"['nya', 'kasih', 'bintang', 'emg', 'ga', 'hambatan', 'semenjak', 'shopee', 'update', 'pengiriman', 'seminggu', 'lebihsedikit', 'kecewa', 'kurangi', 'bintang', 'ya', 'diperbaiki', 'kasih', 'bintang']",nya kasih bintang emg ga hambat semenjak shopee update kirim minggu lebihsedikit kecewa kurang bintang ya baik kasih bintang
1,"Sangat mengecewakan,pesanan sudah sampai di kota tempat /lokasi tujuan pesanan,namun jasa pengantar paket,tidak mau mengantarnya. Dan yang sangat mengecewakan,SMS/chat untuk pemberitahuan pesanan sudah ada di kantor satupun tak ada. Khusus daerah gunung Sitoli. Nias.",Negatif,sangat mengecewakanpesanan sudah sampai di kota tempat lokasi tujuan pesanannamun jasa pengantar pakettidak mau mengantarnya dan yang sangat mengecewakansmschat untuk pemberitahuan pesanan sudah ada di kantor satupun tak ada khusus daerah gunung sitoli nias,mengecewakanpesanan kota lokasi tujuan pesanannamun jasa pengantar pakettidak mengantarnya mengecewakansmschat pemberitahuan pesanan kantor satupun khusus daerah gunung sitoli nias,"['mengecewakanpesanan', 'kota', 'lokasi', 'tujuan', 'pesanannamun', 'jasa', 'pengantar', 'pakettidak', 'mengantarnya', 'mengecewakansmschat', 'pemberitahuan', 'pesanan', 'kantor', 'satupun', 'khusus', 'daerah', 'gunung', 'sitoli', 'nias']",mengecewakanpesanan kota lokasi tuju pesanannamun jasa antar pakettidak antar mengecewakansmschat pemberitahuan pesan kantor satu khusus daerah gunung sitoli nias
