score,content,Label,text_clean,text_StopWord,text_tokens,text_steamindo
5,"seller bilang bisa pakai sicepat,setelah co kenapa langsung jnt,dan tidak bisa diubah lagi. makin ribet nih jasa kirimnya pake mistery box.😇 sekarang lebih kacau lagi sicepat menghancurkan diri dg menutup drop point atau cabang pembantu yg sebenarnya lebih efektif menjangkau wilayah terpencil. sehingga lokasi saya tidak bisa menggunakan sicepat lagi.",Positif,seller bilang bisa pakai sicepatsetelah co kenapa langsung jntdan tidak bisa diubah lagi makin ribet nih jasa kirimnya pake mistery box sekarang lebih kacau lagi sicepat menghancurkan diri dg menutup drop point atau cabang pembantu yg sebenarnya lebih efektif menjangkau wilayah terpencil sehingga lokasi saya tidak bisa menggunakan sicepat lagi,seller bilang pakai sicepatsetelah co langsung jntdan diubah ribet nih jasa kirimnya pake mistery box kacau sicepat menghancurkan dg menutup drop point cabang pembantu yg efektif menjangkau wilayah terpencil lokasi sicepat,"['seller', 'bilang', 'pakai', 'sicepatsetelah', 'co', 'langsung', 'jntdan', 'diubah', 'ribet', 'nih', 'jasa', 'kirimnya', 'pake', 'mistery', 'box', 'kacau', 'sicepat', 'menghancurkan', 'dg', 'menutup', 'drop', 'point', 'cabang', 'pembantu', 'yg', 'efektif', 'menjangkau', 'wilayah', 'terpencil', 'lokasi', 'sicepat']",seller bilang pakai sicepatsetelah co langsung jntdan ubah ribet nih jasa kirim pake mistery box kacau sicepat hancur dg tutup drop point cabang bantu yg efektif jangkau wilayah pencil lokasi sicepat
1,"Sayangnya semakin kesini biaya admin tambah tinggi. Terkadang potongan ke shopee malah lebih banyak daripada untung yg qt dapatkan sbg penjual. Untuk masalah cod cek dulu juga. Harusnya kalo barang sesuai, jangan di retur dong. Udah rugi lakban, bubble, tdk ada kebijakan dari shopee. Cod cek dulu malah lebih tambah bkin rugi. Customer jadi tambah seenaknya. Expedisi SPX juga kalo memang belum bisa jangkau wilayah tersebut. Jangan diaktifkan dong. Bikin rugi karena harus di retur lagi.",Negatif,sayangnya semakin kesini biaya admin tambah tinggi terkadang potongan ke shopee malah lebih banyak daripada untung yg qt dapatkan sbg penjual untuk masalah cod cek dulu juga harusnya kalo barang sesuai jangan di retur dong udah rugi lakban bubble tdk ada kebijakan dari shopee cod cek dulu malah lebih tambah bkin rugi customer jadi tambah seenaknya expedisi spx juga kalo memang belum bisa jangkau wilayah tersebut jangan diaktifkan dong bikin rugi karena harus di retur lagi,sayangnya kesini biaya admin terkadang potongan shopee untung yg qt dapatkan sbg penjual cod cek kalo barang sesuai retur udah rugi lakban bubble tdk kebijakan shopee cod cek bkin rugi customer expedisi spx kalo jangkau wilayah diaktifkan bikin rugi retur,"['sayangnya', 'kesini', 'biaya', 'admin', 'terkadang', 'potongan', 'shopee', 'untung', 'yg', 'qt', 'dapatkan', 'sbg', 'penjual', 'cod', 'cek', 'kalo', 'barang', 'sesuai', 'retur', 'udah', 'rugi', 'lakban', 'bubble', 'tdk', 'kebijakan', 'shopee', 'cod', 'cek', 'bkin', 'rugi', 'customer', 'expedisi', 'spx', 'kalo', 'jangkau', 'wilayah', 'diaktifkan', 'bikin', 'rugi', 'retur']",sayang kesini biaya admin terkadang potong shopee untung yg qt dapat sbg jual cod cek kalo barang sesuai retur udah rugi lakban bubble tdk bijak shopee cod cek bkin rugi customer expedisi spx kalo jangkau wilayah aktif bikin rugi retur
5,"Shopee itu bagus si bnyak membantu tp yg kurang itu soal kurir nya , tlong utk kedepan nya soal foto bukti kirim , yg di foto itu orang nya juga yg menerima paket bukan foto paket nya aja , biar customer bisa tau siapa yg menerima paket tersebut .",Positif,shopee itu bagus si bnyak membantu tp yg kurang itu soal kurir nya  tlong utk kedepan nya soal foto bukti kirim  yg di foto itu orang nya juga yg menerima paket bukan foto paket nya aja  biar customer bisa tau siapa yg menerima paket tersebut ,shopee bagus si bnyak membantu tp yg kurir nya tlong utk kedepan nya foto bukti kirim yg foto orang nya yg menerima paket foto paket nya aja biar customer tau yg menerima paket,"['shopee', 'bagus', 'si', 'bnyak', 'membantu', 'tp', 'yg', 'kurir', 'nya', 'tlong', 'utk', 'kedepan', 'nya', 'foto', 'bukti', 'kirim', 'yg', 'foto', 'orang', 'nya', 'yg', 'menerima', 'paket', 'foto', 'paket', 'nya', 'aja', 'biar', 'customer', 'tau', 'yg', 'menerima', 'paket']",shopee bagus si bnyak bantu tp yg kurir nya tlong utk depan nya foto bukti kirim yg foto orang nya yg terima paket foto paket nya aja biar customer tau yg terima paket
1,"Makin kesini makin parah kebijakan Shopee, gak gitu juga kali cara menarik pembeli, bisa balikin barang kalo berubah pikiran? Disini penjual di permainkan halooo🤣 barang rusak atau salah kirim barang masih masuk akal di return, ini berubah pikiran? Jangan ngadi2 lah Shopee, makin banyak pembeli nakal yg ada🥱🥱🥱🥱",Negatif,makin kesini makin parah kebijakan shopee gak gitu juga kali cara menarik pembeli bisa balikin barang kalo berubah pikiran disini penjual di permainkan halooo barang rusak atau salah kirim barang masih masuk akal di return ini berubah pikiran jangan ngadi lah shopee makin banyak pembeli nakal yg ada,kesini parah kebijakan shopee gak gitu kali menarik pembeli balikin barang kalo berubah pikiran penjual permainkan halooo barang rusak salah kirim barang masuk akal return berubah pikiran ngadi shopee pembeli nakal yg,"['kesini', 'parah', 'kebijakan', 'shopee', 'gak', 'gitu', 'kali', 'menarik', 'pembeli', 'balikin', 'barang', 'kalo', 'berubah', 'pikiran', 'penjual', 'permainkan', 'halooo', 'barang', 'rusak', 'salah', 'kirim', 'barang', 'masuk', 'akal', 'return', 'berubah', 'pikiran', 'ngadi', 'shopee', 'pembeli', 'nakal', 'yg']",kesini parah bijak shopee gak gitu kali tarik beli balikin barang kalo ubah pikir jual main halooo barang rusak salah kirim barang masuk akal return ubah pikir ngadi shopee beli nakal yg
1,"Yang paling menjengkelkan dari Shopee itu selalu muncul halaman ""Sedang Downloading, Kami sedang memuat fitur, mohon tunggu sebentar"" saat proses transaksi, seharian juga gitu terus. Padahal aplikasi sudah update terbaru, koneksi wifi kencang, Ram Rom hape lega. Makin lama makin payah!!!",Negatif,yang paling menjengkelkan dari shopee itu selalu muncul halaman sedang downloading kami sedang memuat fitur mohon tunggu sebentar saat proses transaksi seharian juga gitu terus padahal aplikasi sudah update terbaru koneksi wifi kencang ram rom hape lega makin lama makin payah,menjengkelkan shopee muncul halaman downloading memuat fitur mohon tunggu sebentar proses transaksi seharian gitu aplikasi update terbaru koneksi wifi kencang ram rom hape lega payah,"['menjengkelkan', 'shopee', 'muncul', 'halaman', 'downloading', 'memuat', 'fitur', 'mohon', 'tunggu', 'sebentar', 'proses', 'transaksi', 'seharian', 'gitu', 'aplikasi', 'update', 'terbaru', 'koneksi', 'wifi', 'kencang', 'ram', 'rom', 'hape', 'lega', 'payah']",jengkel shopee muncul halaman downloading muat fitur mohon tunggu sebentar proses transaksi hari gitu aplikasi update baru koneksi wifi kencang ram rom hape lega payah
1,"pembeli tidak bisa memilih jasa kirim dengan sistem random expedisi yang merugikan penggunan luar kota karena tidak semua rekomendasi kurir dari siatem memuliki layanan yang baik, tolong diperbaiki team pengembang shopee, ini sangat merugikan bagi saya.",Negatif,pembeli tidak bisa memilih jasa kirim dengan sistem random expedisi yang merugikan penggunan luar kota karena tidak semua rekomendasi kurir dari siatem memuliki layanan yang baik tolong diperbaiki team pengembang shopee ini sangat merugikan bagi saya,pembeli memilih jasa kirim sistem random expedisi merugikan penggunan kota rekomendasi kurir siatem memuliki layanan tolong diperbaiki team pengembang shopee merugikan,"['pembeli', 'memilih', 'jasa', 'kirim', 'sistem', 'random', 'expedisi', 'merugikan', 'penggunan', 'kota', 'rekomendasi', 'kurir', 'siatem', 'memuliki', 'layanan', 'tolong', 'diperbaiki', 'team', 'pengembang', 'shopee', 'merugikan']",beli pilih jasa kirim sistem random expedisi rugi gun kota rekomendasi kurir siatem pulik layan tolong baik team kembang shopee rugi
1,Voucher 10.000 tidak bisa di klaim.. Terdapat kesalahan terus.. Di suruh mencoba lagi.. Padahal sudah saya coba 10x.. Padahal tertulis jika barang telat datang dari estimasi bisa dapat.. Yang fear donk kalo bikin kebijakan..,Negatif,voucher  tidak bisa di klaim terdapat kesalahan terus di suruh mencoba lagi padahal sudah saya coba x padahal tertulis jika barang telat datang dari estimasi bisa dapat yang fear donk kalo bikin kebijakan,voucher klaim kesalahan suruh mencoba coba x tertulis barang telat estimasi fear donk kalo bikin kebijakan,"['voucher', 'klaim', 'kesalahan', 'suruh', 'mencoba', 'coba', 'x', 'tertulis', 'barang', 'telat', 'estimasi', 'fear', 'donk', 'kalo', 'bikin', 'kebijakan']",voucher klaim salah suruh coba coba x tulis barang telat estimasi fear donk kalo bikin bijak
1,"Maaf kak ini setelah diupdate apilaksinya terus mau ganti nomor HP yang sudah tidak aktif dan email yang tidak aktif, gagal gagal terus padahal sudah diisi sesuai dan benar tetapi keterangan gagal dan coba diisi dengan benar, versi aplikasi sudah terbaru, mohon dibantu kak. Terimakasih",Negatif,maaf kak ini setelah diupdate apilaksinya terus mau ganti nomor hp yang sudah tidak aktif dan email yang tidak aktif gagal gagal terus padahal sudah diisi sesuai dan benar tetapi keterangan gagal dan coba diisi dengan benar versi aplikasi sudah terbaru mohon dibantu kak terimakasih,maaf kak diupdate apilaksinya ganti nomor hp aktif email aktif gagal gagal diisi sesuai keterangan gagal coba diisi versi aplikasi terbaru mohon dibantu kak terimakasih,"['maaf', 'kak', 'diupdate', 'apilaksinya', 'ganti', 'nomor', 'hp', 'aktif', 'email', 'aktif', 'gagal', 'gagal', 'diisi', 'sesuai', 'keterangan', 'gagal', 'coba', 'diisi', 'versi', 'aplikasi', 'terbaru', 'mohon', 'dibantu', 'kak', 'terimakasih']",maaf kak diupdate apilaksinya ganti nomor hp aktif email aktif gagal gagal isi sesuai terang gagal coba isi versi aplikasi baru mohon bantu kak terimakasih
1,"Aplikasi nya suka nge bug, mau check out juga ga bisa cepet padahal jaringan udah bagus. Ditambah lagi sering log out sendiri loh dan kalau masuk selalu log in ulang. Tolong dong perbaiki, dulu padahal serasa nyaman tapi semakin kesini semakin bikin kesel aja",Negatif,aplikasi nya suka nge bug mau check out juga ga bisa cepet padahal jaringan udah bagus ditambah lagi sering log out sendiri loh dan kalau masuk selalu log in ulang tolong dong perbaiki dulu padahal serasa nyaman tapi semakin kesini semakin bikin kesel aja,aplikasi nya suka nge bug check out ga cepet jaringan udah bagus ditambah log out loh masuk log in ulang tolong perbaiki serasa nyaman kesini bikin kesel aja,"['aplikasi', 'nya', 'suka', 'nge', 'bug', 'check', 'out', 'ga', 'cepet', 'jaringan', 'udah', 'bagus', 'ditambah', 'log', 'out', 'loh', 'masuk', 'log', 'in', 'ulang', 'tolong', 'perbaiki', 'serasa', 'nyaman', 'kesini', 'bikin', 'kesel', 'aja']",aplikasi nya suka nge bug check out ga cepet jaring udah bagus tambah log out loh masuk log in ulang tolong baik serasa nyaman kesini bikin kesel aja
2,"Kenapa toko atau produk luar di blokir padahal saya butuh barang dari luar. Kadang juga suka bug dan lag kayak di map pengiriman SPX sama status barang juga kadang ga jelas, di app masih dalam perjalanan tapi barangnya sudah sampai di rumah. Mohon di perbaiki",Negatif,kenapa toko atau produk luar di blokir padahal saya butuh barang dari luar kadang juga suka bug dan lag kayak di map pengiriman spx sama status barang juga kadang ga jelas di app masih dalam perjalanan tapi barangnya sudah sampai di rumah mohon di perbaiki,toko produk blokir butuh barang kadang suka bug lag kayak map pengiriman spx status barang kadang ga app perjalanan barangnya rumah mohon perbaiki,"['toko', 'produk', 'blokir', 'butuh', 'barang', 'kadang', 'suka', 'bug', 'lag', 'kayak', 'map', 'pengiriman', 'spx', 'status', 'barang', 'kadang', 'ga', 'app', 'perjalanan', 'barangnya', 'rumah', 'mohon', 'perbaiki']",toko produk blokir butuh barang kadang suka bug lag kayak map kirim spx status barang kadang ga app jalan barang rumah mohon baik
2,"Halo shopee layanan jasa pengiriman anda sangat lambat ,masa kalah sama lazada pengirimannya lebih cepat,,tolong lah di perbaiki,kami gk butuh voucher keterlambatan ,kami hanya butuh kecepatan dalam pengiriman barangnya.",Negatif,halo shopee layanan jasa pengiriman anda sangat lambat masa kalah sama lazada pengirimannya lebih cepattolong lah di perbaikikami gk butuh voucher keterlambatan kami hanya butuh kecepatan dalam pengiriman barangnya,halo shopee layanan jasa pengiriman lambat kalah lazada pengirimannya cepattolong perbaikikami gk butuh voucher keterlambatan butuh kecepatan pengiriman barangnya,"['halo', 'shopee', 'layanan', 'jasa', 'pengiriman', 'lambat', 'kalah', 'lazada', 'pengirimannya', 'cepattolong', 'perbaikikami', 'gk', 'butuh', 'voucher', 'keterlambatan', 'butuh', 'kecepatan', 'pengiriman', 'barangnya']",halo shopee layan jasa kirim lambat kalah lazada kirim cepattolong perbaikikami gk butuh voucher lambat butuh cepat kirim barang
4,"Dari segi performa dll udah bagus banget. Betah banget belanja di Shopee. Cuma ada satu mslh, dmna waktu aplikasi nya di reset data/ dihapus, semua riwayat pembelian, koin Shopee, dan riwayat Checkout itu hilang semua. Ga mslh sih koin Shopee nya hilang cuma yg ngeselin riwayat pembelian dan Checkout itu. Apalagi riwayat seperti pembelian itu sangat penting buat jadi bukti. Pdhl udah login pake akun kok ga kesimpen ya? Apa emng dari Shopee ato gmna nih? Kaget aja gitu, masa hilang semua?",Positif,dari segi performa dll udah bagus banget betah banget belanja di shopee cuma ada satu mslh dmna waktu aplikasi nya di reset data dihapus semua riwayat pembelian koin shopee dan riwayat checkout itu hilang semua ga mslh sih koin shopee nya hilang cuma yg ngeselin riwayat pembelian dan checkout itu apalagi riwayat seperti pembelian itu sangat penting buat jadi bukti pdhl udah login pake akun kok ga kesimpen ya apa emng dari shopee ato gmna nih kaget aja gitu masa hilang semua,segi performa dll udah bagus banget betah banget belanja shopee mslh dmna aplikasi nya reset data dihapus riwayat pembelian koin shopee riwayat checkout hilang ga mslh sih koin shopee nya hilang yg ngeselin riwayat pembelian checkout riwayat pembelian bukti pdhl udah login pake akun ga kesimpen ya emng shopee ato gmna nih kaget aja gitu hilang,"['segi', 'performa', 'dll', 'udah', 'bagus', 'banget', 'betah', 'banget', 'belanja', 'shopee', 'mslh', 'dmna', 'aplikasi', 'nya', 'reset', 'data', 'dihapus', 'riwayat', 'pembelian', 'koin', 'shopee', 'riwayat', 'checkout', 'hilang', 'ga', 'mslh', 'sih', 'koin', 'shopee', 'nya', 'hilang', 'yg', 'ngeselin', 'riwayat', 'pembelian', 'checkout', 'riwayat', 'pembelian', 'bukti', 'pdhl', 'udah', 'login', 'pake', 'akun', 'ga', 'kesimpen', 'ya', 'emng', 'shopee', 'ato', 'gmna', 'nih', 'kaget', 'aja', 'gitu', 'hilang']",segi performa dll udah bagus banget betah banget belanja shopee mslh dmna aplikasi nya reset data hapus riwayat beli koin shopee riwayat checkout hilang ga mslh sih koin shopee nya hilang yg ngeselin riwayat beli checkout riwayat beli bukti pdhl udah login pake akun ga kesimpen ya emng shopee ato gmna nih kaget aja gitu hilang
1,"Tolong adakan menu seting untuk mematikan semua live video ,ngelag2 hp saya!!dan boros kuota. Pdhl kontennya jg gk senonoh!dan fitur dark mode! Silau tau!!",Negatif,tolong adakan menu seting untuk mematikan semua live video ngelag hp sayadan boros kuota pdhl kontennya jg gk senonohdan fitur dark mode silau tau,tolong adakan menu seting mematikan live video ngelag hp sayadan boros kuota pdhl kontennya jg gk senonohdan fitur dark mode silau tau,"['tolong', 'adakan', 'menu', 'seting', 'mematikan', 'live', 'video', 'ngelag', 'hp', 'sayadan', 'boros', 'kuota', 'pdhl', 'kontennya', 'jg', 'gk', 'senonohdan', 'fitur', 'dark', 'mode', 'silau', 'tau']",tolong adakan menu ting mati live video ngelag hp sayadan boros kuota pdhl konten jg gk senonohdan fitur dark mode silau tau
1,"Lemot banget aplikasinya mana kalo loading lama banget, ngeklik satu item atau pun apa tetep aja gabisa padahal udah upgrade apk yang baru terus",Negatif,lemot banget aplikasinya mana kalo loading lama banget ngeklik satu item atau pun apa tetep aja gabisa padahal udah upgrade apk yang baru terus,lemot banget aplikasinya kalo loading banget ngeklik item tetep aja gabisa udah upgrade apk,"['lemot', 'banget', 'aplikasinya', 'kalo', 'loading', 'banget', 'ngeklik', 'item', 'tetep', 'aja', 'gabisa', 'udah', 'upgrade', 'apk']",lot banget aplikasi kalo loading banget ngeklik item tetep aja gabisa udah upgrade apk
5,"Saya suka dengan mode transaksi nya mudah, banyak gratis ongkir, menggunakan paylater nya pun mudah, kekurangan bisa di tambah dari saldo sohopee pay... Cuma, belum ada peningkatan pinjaman spaylater nya meningkat...",Positif,saya suka dengan mode transaksi nya mudah banyak gratis ongkir menggunakan paylater nya pun mudah kekurangan bisa di tambah dari saldo sohopee pay cuma belum ada peningkatan pinjaman spaylater nya meningkat,suka mode transaksi nya mudah gratis ongkir paylater nya mudah kekurangan saldo sohopee pay peningkatan pinjaman spaylater nya meningkat,"['suka', 'mode', 'transaksi', 'nya', 'mudah', 'gratis', 'ongkir', 'paylater', 'nya', 'mudah', 'kekurangan', 'saldo', 'sohopee', 'pay', 'peningkatan', 'pinjaman', 'spaylater', 'nya', 'meningkat']",suka mode transaksi nya mudah gratis ongkir paylater nya mudah kurang saldo sohopee pay tingkat pinjam spaylater nya tingkat
4,Untuk aplikasi sangat bagus dan sangat mempermudah tapi ada kekecewaan 2 x beli HP padahal di iklanya official store tapi setelah di pesan HP tersebut bukan original sampe saya mengirimkan bukti yg ORI dan bukan ORI ini yg sangat membuat sy kecewa ditambah sy membeli mengunakan shoppe paylater. Mohon tindak lanjutnya dr pihak shoppe utk pengembalian dana dan menindaklanjuti toko2 HP yg nakal. Terima kasih,Positif,untuk aplikasi sangat bagus dan sangat mempermudah tapi ada kekecewaan  x beli hp padahal di iklanya official store tapi setelah di pesan hp tersebut bukan original sampe saya mengirimkan bukti yg ori dan bukan ori ini yg sangat membuat sy kecewa ditambah sy membeli mengunakan shoppe paylater mohon tindak lanjutnya dr pihak shoppe utk pengembalian dana dan menindaklanjuti toko hp yg nakal terima kasih,aplikasi bagus mempermudah kekecewaan x beli hp iklanya official store pesan hp original sampe mengirimkan bukti yg ori ori yg sy kecewa ditambah sy membeli mengunakan shoppe paylater mohon tindak dr shoppe utk pengembalian dana menindaklanjuti toko hp yg nakal terima kasih,"['aplikasi', 'bagus', 'mempermudah', 'kekecewaan', 'x', 'beli', 'hp', 'iklanya', 'official', 'store', 'pesan', 'hp', 'original', 'sampe', 'mengirimkan', 'bukti', 'yg', 'ori', 'ori', 'yg', 'sy', 'kecewa', 'ditambah', 'sy', 'membeli', 'mengunakan', 'shoppe', 'paylater', 'mohon', 'tindak', 'dr', 'shoppe', 'utk', 'pengembalian', 'dana', 'menindaklanjuti', 'toko', 'hp', 'yg', 'nakal', 'terima', 'kasih']",aplikasi bagus mudah kecewa x beli hp iklanya official store pesan hp original sampe kirim bukti yg ori ori yg sy kecewa tambah sy beli mengunakan shoppe paylater mohon tindak dr shoppe utk kembali dana menindaklanjuti toko hp yg nakal terima kasih
2,Walaupun sekarang sudah ada fitur COD cek dulu dan bisa dikembalikan barangnya ... Tapi sekarang penjualnya hanya mengambil identitas pembeli tetapi mengirim barang lewat transaksi diluar shopee... Saya sudah ketipu 2× ... Kalau saya dirumah ya tidak saya terima paketnya... Ini posisi tidak dirumah yang menerima paket keluarga,Negatif,walaupun sekarang sudah ada fitur cod cek dulu dan bisa dikembalikan barangnya  tapi sekarang penjualnya hanya mengambil identitas pembeli tetapi mengirim barang lewat transaksi diluar shopee saya sudah ketipu   kalau saya dirumah ya tidak saya terima paketnya ini posisi tidak dirumah yang menerima paket keluarga,fitur cod cek dikembalikan barangnya penjualnya mengambil identitas pembeli mengirim barang transaksi diluar shopee ketipu dirumah ya terima paketnya posisi dirumah menerima paket keluarga,"['fitur', 'cod', 'cek', 'dikembalikan', 'barangnya', 'penjualnya', 'mengambil', 'identitas', 'pembeli', 'mengirim', 'barang', 'transaksi', 'diluar', 'shopee', 'ketipu', 'dirumah', 'ya', 'terima', 'paketnya', 'posisi', 'dirumah', 'menerima', 'paket', 'keluarga']",fitur cod cek kembali barang jual ambil identitas beli kirim barang transaksi luar shopee tipu rumah ya terima paket posisi rumah terima paket keluarga
1,"Shopee makin lemot sekarang, terus saya clear all data dan reinstall app shopee, tapi sekarang malah tidak bisa login di aplikasi shopee, stuk di form login, ga ada loading, peringatan dll, sudah coba pakai OTP dan password tetap gagal.",Negatif,shopee makin lemot sekarang terus saya clear all data dan reinstall app shopee tapi sekarang malah tidak bisa login di aplikasi shopee stuk di form login ga ada loading peringatan dll sudah coba pakai otp dan password tetap gagal,shopee lemot clear all data reinstall app shopee login aplikasi shopee stuk form login ga loading peringatan dll coba pakai otp password gagal,"['shopee', 'lemot', 'clear', 'all', 'data', 'reinstall', 'app', 'shopee', 'login', 'aplikasi', 'shopee', 'stuk', 'form', 'login', 'ga', 'loading', 'peringatan', 'dll', 'coba', 'pakai', 'otp', 'password', 'gagal']",shopee lot clear all data reinstall app shopee login aplikasi shopee stuk form login ga loading ingat dll coba pakai otp password gagal
5,"Senang, aman, saran untuk menyertakan NO. TLP KURIR agar bisa di arahkan nantinya. Serta notifikasi pesanan tolong secara berkala..sbg contoh pesanan akan tiba dalam 1 jam biar kita gak kayak PHP nunggu pesanan yg gak pasti krn gak jelas notifikasi nya..",Positif,senang aman saran untuk menyertakan no tlp kurir agar bisa di arahkan nantinya serta notifikasi pesanan tolong secara berkalasbg contoh pesanan akan tiba dalam  jam biar kita gak kayak php nunggu pesanan yg gak pasti krn gak jelas notifikasi nya,senang aman saran menyertakan no tlp kurir arahkan notifikasi pesanan tolong berkalasbg contoh pesanan jam biar gak kayak php nunggu pesanan yg gak krn gak notifikasi nya,"['senang', 'aman', 'saran', 'menyertakan', 'no', 'tlp', 'kurir', 'arahkan', 'notifikasi', 'pesanan', 'tolong', 'berkalasbg', 'contoh', 'pesanan', 'jam', 'biar', 'gak', 'kayak', 'php', 'nunggu', 'pesanan', 'yg', 'gak', 'krn', 'gak', 'notifikasi', 'nya']",senang aman saran serta no tlp kurir arah notifikasi pesan tolong berkalasbg contoh pesan jam biar gak kayak php nunggu pesan yg gak krn gak notifikasi nya
5,"Aplikasi ini bener"" good job... sangat membantu sekali dalam segi kantong untuk para ibu"" pencari diskon... dan untuk org"" yg mager... semua barang apapun yg pengen kita cari dan beli ada disini smua.. pelayanannya juga bagus permasalahan apapun bisa terselesaikan semua tim shopee bekerja dengan baik dan efisien, andthen good job sukses terus yaa buat shopee...",Positif,aplikasi ini bener good job sangat membantu sekali dalam segi kantong untuk para ibu pencari diskon dan untuk org yg mager semua barang apapun yg pengen kita cari dan beli ada disini smua pelayanannya juga bagus permasalahan apapun bisa terselesaikan semua tim shopee bekerja dengan baik dan efisien andthen good job sukses terus yaa buat shopee,aplikasi bener good job membantu segi kantong pencari diskon org yg mager barang apapun yg pengen cari beli smua pelayanannya bagus permasalahan apapun terselesaikan tim shopee efisien andthen good job sukses yaa shopee,"['aplikasi', 'bener', 'good', 'job', 'membantu', 'segi', 'kantong', 'pencari', 'diskon', 'org', 'yg', 'mager', 'barang', 'apapun', 'yg', 'pengen', 'cari', 'beli', 'smua', 'pelayanannya', 'bagus', 'permasalahan', 'apapun', 'terselesaikan', 'tim', 'shopee', 'efisien', 'andthen', 'good', 'job', 'sukses', 'yaa', 'shopee']",aplikasi bener good job bantu segi kantong cari diskon org yg mager barang apa yg ken cari beli smua layan bagus masalah apa selesai tim shopee efisien andthen good job sukses yaa shopee
1,"pengiriman nya lama bangett, ga sesuai estimasi. nyampe sekarangg paket saya ga dateng dateng, tau gini mending beli di tiktok shoop, 3 hari langsung dateng, terus ga saya mau chat kurir nya ga bisa. shoope sekarang udah mulai ga konsisten ke pelanggan. saya kasih rate rendah, karna saya kecewa",Negatif,pengiriman nya lama bangett ga sesuai estimasi nyampe sekarangg paket saya ga dateng dateng tau gini mending beli di tiktok shoop  hari langsung dateng terus ga saya mau chat kurir nya ga bisa shoope sekarang udah mulai ga konsisten ke pelanggan saya kasih rate rendah karna saya kecewa,pengiriman nya bangett ga sesuai estimasi nyampe sekarangg paket ga dateng dateng tau gini mending beli tiktok shoop langsung dateng ga chat kurir nya ga shoope udah ga konsisten pelanggan kasih rate rendah karna kecewa,"['pengiriman', 'nya', 'bangett', 'ga', 'sesuai', 'estimasi', 'nyampe', 'sekarangg', 'paket', 'ga', 'dateng', 'dateng', 'tau', 'gini', 'mending', 'beli', 'tiktok', 'shoop', 'langsung', 'dateng', 'ga', 'chat', 'kurir', 'nya', 'ga', 'shoope', 'udah', 'ga', 'konsisten', 'pelanggan', 'kasih', 'rate', 'rendah', 'karna', 'kecewa']",kirim nya bangett ga sesuai estimasi nyampe sekarangg paket ga dateng dateng tau gin mending beli tiktok shoop langsung dateng ga chat kurir nya ga shoope udah ga konsisten langgan kasih rate rendah karna kecewa
