score,content,Label,text_clean,text_StopWord,text_tokens,text_steamindo
1,"buka aplikasi langsung di arahkan ke menu live. sedangkan live streaming itu boros data & baterai. bagi yang punya wifi atau punya kuota banyak tidak masalah, namun bagaimana dengan yang tidak punya wifi dan kuota sangat terbatas? saingan dengan live shop aplikasi lain user jadi tumbal.",Negatif,buka aplikasi langsung di arahkan ke menu live sedangkan live streaming itu boros data  baterai bagi yang punya wifi atau punya kuota banyak tidak masalah namun bagaimana dengan yang tidak punya wifi dan kuota sangat terbatas saingan dengan live shop aplikasi lain user jadi tumbal,buka aplikasi langsung arahkan menu live live streaming boros data baterai wifi kuota wifi kuota terbatas saingan live shop aplikasi user tumbal,"['buka', 'aplikasi', 'langsung', 'arahkan', 'menu', 'live', 'live', 'streaming', 'boros', 'data', 'baterai', 'wifi', 'kuota', 'wifi', 'kuota', 'terbatas', 'saingan', 'live', 'shop', 'aplikasi', 'user', 'tumbal']",buka aplikasi langsung arah menu live live streaming boros data baterai wifi kuota wifi kuota batas saing live shop aplikasi user tumbal
5,"Sejauh ini belum ada masalah berarti, hanya saja kadang setelah meninggalkan app di posisi Shopee Live/Video, membuka app lagi akan kembali ke Live/Video dan pindah ke tab lainnya video/live tetap akan berjalan.",Positif,sejauh ini belum ada masalah berarti hanya saja kadang setelah meninggalkan app di posisi shopee livevideo membuka app lagi akan kembali ke livevideo dan pindah ke tab lainnya videolive tetap akan berjalan,kadang meninggalkan app posisi shopee livevideo membuka app livevideo pindah tab videolive berjalan,"['kadang', 'meninggalkan', 'app', 'posisi', 'shopee', 'livevideo', 'membuka', 'app', 'livevideo', 'pindah', 'tab', 'videolive', 'berjalan']",kadang tinggal app posisi shopee livevideo buka app livevideo pindah tab videolive jalan
1,"semenjak di perbarui,,kok jadi eror Shopee ???Nge bug,,,dan ngelag kadang tiba tiba keluar sendiri klw gini ,,kmgkinan banyak yg malas buka aplikasi Shopee tolonglah di perbaiki,,biar pengguna puas terimakasih",Negatif,semenjak di perbaruikok jadi eror shopee nge bugdan ngelag kadang tiba tiba keluar sendiri klw gini kmgkinan banyak yg malas buka aplikasi shopee tolonglah di perbaikibiar pengguna puas terimakasih,semenjak perbaruikok eror shopee nge bugdan ngelag kadang klw gini kmgkinan yg malas buka aplikasi shopee tolonglah perbaikibiar pengguna puas terimakasih,"['semenjak', 'perbaruikok', 'eror', 'shopee', 'nge', 'bugdan', 'ngelag', 'kadang', 'klw', 'gini', 'kmgkinan', 'yg', 'malas', 'buka', 'aplikasi', 'shopee', 'tolonglah', 'perbaikibiar', 'pengguna', 'puas', 'terimakasih']",semenjak perbaruikok eror shopee nge bugdan ngelag kadang klw gin kmgkinan yg malas buka aplikasi shopee tolong perbaikibiar guna puas terimakasih
2,"Udah ke 5x nya pesan nggk sampai ke tujuan, expedisi spx express sangat kecewa, status di kirim ke tempat tujuan... Tpi ga sampe, ujungnya barang di kembalikan, kembalikan jnt, klo gni geser ke app sblah",Negatif,udah ke x nya pesan nggk sampai ke tujuan expedisi spx express sangat kecewa status di kirim ke tempat tujuan tpi ga sampe ujungnya barang di kembalikan kembalikan jnt klo gni geser ke app sblah,udah x nya pesan nggk tujuan expedisi spx express kecewa status kirim tujuan tpi ga sampe ujungnya barang kembalikan kembalikan jnt klo gni geser app sblah,"['udah', 'x', 'nya', 'pesan', 'nggk', 'tujuan', 'expedisi', 'spx', 'express', 'kecewa', 'status', 'kirim', 'tujuan', 'tpi', 'ga', 'sampe', 'ujungnya', 'barang', 'kembalikan', 'kembalikan', 'jnt', 'klo', 'gni', 'geser', 'app', 'sblah']",udah x nya pesan nggk tuju expedisi spx express kecewa status kirim tuju tpi ga sampe ujung barang kembali kembali jnt klo gni geser app sblah
5,Aplikasi lumayan menguntungkan yaa. bisa nyari produk tertentu dgn harga termurah . Bnyak promo diskon dan gratis ongkir juga . Pokoknya aku seringkali diuntungkan sih pakai aplikasi shopee .,Positif,aplikasi lumayan menguntungkan yaa bisa nyari produk tertentu dgn harga termurah  bnyak promo diskon dan gratis ongkir juga  pokoknya aku seringkali diuntungkan sih pakai aplikasi shopee ,aplikasi lumayan menguntungkan yaa nyari produk dgn harga termurah bnyak promo diskon gratis ongkir pokoknya seringkali diuntungkan sih pakai aplikasi shopee,"['aplikasi', 'lumayan', 'menguntungkan', 'yaa', 'nyari', 'produk', 'dgn', 'harga', 'termurah', 'bnyak', 'promo', 'diskon', 'gratis', 'ongkir', 'pokoknya', 'seringkali', 'diuntungkan', 'sih', 'pakai', 'aplikasi', 'shopee']",aplikasi lumayan untung yaa nyari produk dgn harga murah bnyak promo diskon gratis ongkir pokok seringkali untung sih pakai aplikasi shopee
2,"Saran saya diubah system flash sale nya Yang dapat gk sesuai atau gak tepat Masa harus cepat pasti, yg handphone nya bagus dan fasilitas bagus seperti internet dan wifi yg super lancar yang selalu dapat, kasian mereka yang udah berusaha tapi gak dapet dapet krna kendala handphone ataupun internet yang kurang oke sarannya diganti system flash sale nya Biar yang gapunya hp atau hp nya jelek bisa dapat kesempatan juga Jadi gak nyesel download shoppe buat belanja dan segala macam nya",Negatif,saran saya diubah system flash sale nya yang dapat gk sesuai atau gak tepat masa harus cepat pasti yg handphone nya bagus dan fasilitas bagus seperti internet dan wifi yg super lancar yang selalu dapat kasian mereka yang udah berusaha tapi gak dapet dapet krna kendala handphone ataupun internet yang kurang oke sarannya diganti system flash sale nya biar yang gapunya hp atau hp nya jelek bisa dapat kesempatan juga jadi gak nyesel download shoppe buat belanja dan segala macam nya,saran diubah system flash sale nya gk sesuai gak cepat yg handphone nya bagus fasilitas bagus internet wifi yg super lancar kasian udah berusaha gak dapet dapet krna kendala handphone internet oke sarannya diganti system flash sale nya biar gapunya hp hp nya jelek kesempatan gak nyesel download shoppe belanja nya,"['saran', 'diubah', 'system', 'flash', 'sale', 'nya', 'gk', 'sesuai', 'gak', 'cepat', 'yg', 'handphone', 'nya', 'bagus', 'fasilitas', 'bagus', 'internet', 'wifi', 'yg', 'super', 'lancar', 'kasian', 'udah', 'berusaha', 'gak', 'dapet', 'dapet', 'krna', 'kendala', 'handphone', 'internet', 'oke', 'sarannya', 'diganti', 'system', 'flash', 'sale', 'nya', 'biar', 'gapunya', 'hp', 'hp', 'nya', 'jelek', 'kesempatan', 'gak', 'nyesel', 'download', 'shoppe', 'belanja', 'nya']",saran ubah system flash sale nya gk sesuai gak cepat yg handphone nya bagus fasilitas bagus internet wifi yg super lancar kasi udah usaha gak dapet dapet krna kendala handphone internet oke saran ganti system flash sale nya biar gapunya hp hp nya jelek sempat gak nyesel download shoppe belanja nya
5,"Aplikasi nya bgs² aja tp kalau bisa itu pas paket di anter ke alamat tujuan itu kalau bisa dikasih nama dan no hp kurir,soal nya biasanya kurir nya kalau nganter paket biasanya ga konfirmasi dulu ke pihak pembeli.terimakasihh",Positif,aplikasi nya bgs aja tp kalau bisa itu pas paket di anter ke alamat tujuan itu kalau bisa dikasih nama dan no hp kurirsoal nya biasanya kurir nya kalau nganter paket biasanya ga konfirmasi dulu ke pihak pembeliterimakasihh,aplikasi nya bgs aja tp pas paket anter alamat tujuan dikasih nama no hp kurirsoal nya kurir nya nganter paket ga konfirmasi pembeliterimakasihh,"['aplikasi', 'nya', 'bgs', 'aja', 'tp', 'pas', 'paket', 'anter', 'alamat', 'tujuan', 'dikasih', 'nama', 'no', 'hp', 'kurirsoal', 'nya', 'kurir', 'nya', 'nganter', 'paket', 'ga', 'konfirmasi', 'pembeliterimakasihh']",aplikasi nya bgs aja tp pas paket anter alamat tuju kasih nama no hp kurirsoal nya kurir nya nganter paket ga konfirmasi pembeliterimakasihh
4,Aplikasi ny bagus banget no tipu tipu kyk yg sebelah!!! Aku suka banget banyak diskon dan gratis ongkir paket pun cepat sampe. Cuman ini akun tiba-tiba hilang dan gk bisa masuk ke akun lama pas coba akun ini tidak berlaku di negara ini,Positif,aplikasi ny bagus banget no tipu tipu kyk yg sebelah aku suka banget banyak diskon dan gratis ongkir paket pun cepat sampe cuman ini akun tibatiba hilang dan gk bisa masuk ke akun lama pas coba akun ini tidak berlaku di negara ini,aplikasi ny bagus banget no tipu tipu kyk yg sebelah suka banget diskon gratis ongkir paket cepat sampe cuman akun tibatiba hilang gk masuk akun pas coba akun berlaku negara,"['aplikasi', 'ny', 'bagus', 'banget', 'no', 'tipu', 'tipu', 'kyk', 'yg', 'sebelah', 'suka', 'banget', 'diskon', 'gratis', 'ongkir', 'paket', 'cepat', 'sampe', 'cuman', 'akun', 'tibatiba', 'hilang', 'gk', 'masuk', 'akun', 'pas', 'coba', 'akun', 'berlaku', 'negara']",aplikasi ny bagus banget no tipu tipu kyk yg belah suka banget diskon gratis ongkir paket cepat sampe cuman akun tibatiba hilang gk masuk akun pas coba akun laku negara
1,"1. Setelah di update ke versi terbaru malah sering ngefreeze & ngelag. 2. yg menang flash sale itu hanya orang-orang yg gadgetnya spek dewa & jaringan bagus, gak adil bagi yg gadgetnya spek kentang, SANGAT TIDAK ADIL. 3. Ekpedisi Shopee Express tidak profesional, mengecewakan, bagusnya ditutup aja, jauh lebih baik J&T ketimbang SPX.",Negatif, setelah di update ke versi terbaru malah sering ngefreeze  ngelag  yg menang flash sale itu hanya orangorang yg gadgetnya spek dewa  jaringan bagus gak adil bagi yg gadgetnya spek kentang sangat tidak adil  ekpedisi shopee express tidak profesional mengecewakan bagusnya ditutup aja jauh lebih baik jt ketimbang spx,update versi terbaru ngefreeze ngelag yg menang flash sale orangorang yg gadgetnya spek dewa jaringan bagus gak adil yg gadgetnya spek kentang adil ekpedisi shopee express profesional mengecewakan bagusnya ditutup aja jt ketimbang spx,"['update', 'versi', 'terbaru', 'ngefreeze', 'ngelag', 'yg', 'menang', 'flash', 'sale', 'orangorang', 'yg', 'gadgetnya', 'spek', 'dewa', 'jaringan', 'bagus', 'gak', 'adil', 'yg', 'gadgetnya', 'spek', 'kentang', 'adil', 'ekpedisi', 'shopee', 'express', 'profesional', 'mengecewakan', 'bagusnya', 'ditutup', 'aja', 'jt', 'ketimbang', 'spx']",update versi baru ngefreeze ngelag yg menang flash sale orangorang yg gadgetnya spek dewa jaring bagus gak adil yg gadgetnya spek kentang adil ekpedisi shopee express profesional kecewa bagus tutup aja jt ketimbang spx
5,"Alhamdulillah saya puas dengan layanan Shopee. Ada gratis ongkir ada voucher,, pkoknya suka deh jadi mudah buat belanja gak capek2 LG mau cari baju di pasarrrr . Mending beli online aja GK ribet, semoga semua seller nya bisa amanah yaaa",Positif,alhamdulillah saya puas dengan layanan shopee ada gratis ongkir ada voucher pkoknya suka deh jadi mudah buat belanja gak capek lg mau cari baju di pasarrrr  mending beli online aja gk ribet semoga semua seller nya bisa amanah yaaa,alhamdulillah puas layanan shopee gratis ongkir voucher pkoknya suka deh mudah belanja gak capek lg cari baju pasarrrr mending beli online aja gk ribet semoga seller nya amanah yaaa,"['alhamdulillah', 'puas', 'layanan', 'shopee', 'gratis', 'ongkir', 'voucher', 'pkoknya', 'suka', 'deh', 'mudah', 'belanja', 'gak', 'capek', 'lg', 'cari', 'baju', 'pasarrrr', 'mending', 'beli', 'online', 'aja', 'gk', 'ribet', 'semoga', 'seller', 'nya', 'amanah', 'yaaa']",alhamdulillah puas layan shopee gratis ongkir voucher pkoknya suka deh mudah belanja gak capek lg cari baju pasarrrr mending beli online aja gk ribet moga seller nya amanah yaaa
2,Tolong Aplikasinya di Benahi... Soalnya tiap buka Aplikasinya suka muncul Live shopee jadi sangat sangat menganggu apalagi hp yang ramnya kecil... Dan mau ngecek produk lain aja masih terdengar orang lagi live di shopee.. tolong di benahi kembalikan seperti dulu,Negatif,tolong aplikasinya di benahi soalnya tiap buka aplikasinya suka muncul live shopee jadi sangat sangat menganggu apalagi hp yang ramnya kecil dan mau ngecek produk lain aja masih terdengar orang lagi live di shopee tolong di benahi kembalikan seperti dulu,tolong aplikasinya benahi buka aplikasinya suka muncul live shopee menganggu hp ramnya ngecek produk aja terdengar orang live shopee tolong benahi kembalikan,"['tolong', 'aplikasinya', 'benahi', 'buka', 'aplikasinya', 'suka', 'muncul', 'live', 'shopee', 'menganggu', 'hp', 'ramnya', 'ngecek', 'produk', 'aja', 'terdengar', 'orang', 'live', 'shopee', 'tolong', 'benahi', 'kembalikan']",tolong aplikasi benah buka aplikasi suka muncul live shopee menganggu hp ram ngecek produk aja dengar orang live shopee tolong benah kembali
1,"pengiriman instan 2 jam, nyatanya sering kali dikirimkan keesokan harinya oleh penjual... padahal harapan buyer memilih pengiriman instan 2 jam adalah barang dapat diterima secepat mungkin, dan segera digunakan. tapi disini malah seharian baru sampai, alias sama dengan sameday, atau malah baru diterima keesokan harinya 😌",Negatif,pengiriman instan  jam nyatanya sering kali dikirimkan keesokan harinya oleh penjual padahal harapan buyer memilih pengiriman instan  jam adalah barang dapat diterima secepat mungkin dan segera digunakan tapi disini malah seharian baru sampai alias sama dengan sameday atau malah baru diterima keesokan harinya ,pengiriman instan jam kali dikirimkan keesokan harinya penjual harapan buyer memilih pengiriman instan jam barang diterima secepat seharian alias sameday diterima keesokan harinya,"['pengiriman', 'instan', 'jam', 'kali', 'dikirimkan', 'keesokan', 'harinya', 'penjual', 'harapan', 'buyer', 'memilih', 'pengiriman', 'instan', 'jam', 'barang', 'diterima', 'secepat', 'seharian', 'alias', 'sameday', 'diterima', 'keesokan', 'harinya']",kirim instan jam kali kirim esok hari jual harap buyer pilih kirim instan jam barang terima cepat hari alias sameday terima esok hari
5,"Semenjak ada Shopee semua keperluan tinggal pesen , tdk repot , mudah, hemat waktu, barang/produk nya bagus dan OK.. Terimakasih Shopee..TOP",Positif,semenjak ada shopee semua keperluan tinggal pesen  tdk repot  mudah hemat waktu barangproduk nya bagus dan ok terimakasih shopeetop,semenjak shopee keperluan tinggal pesen tdk repot mudah hemat barangproduk nya bagus ok terimakasih shopeetop,"['semenjak', 'shopee', 'keperluan', 'tinggal', 'pesen', 'tdk', 'repot', 'mudah', 'hemat', 'barangproduk', 'nya', 'bagus', 'ok', 'terimakasih', 'shopeetop']",semenjak shopee perlu tinggal sen tdk repot mudah hemat barangproduk nya bagus ok terimakasih shopeetop
1,"Ekspedisi SPX mending gak usah ikut2an di pengantaran, pelayanan sangat buruk, pesan makanan 11 hari belum sampai2, alasannya alamat tidak lengkap, padahal paket yg lain dengan alamat yg lain lgsg sampai, tolong ekspedisi2 & kurir2 yg lelet diberi sanksi!",Negatif,ekspedisi spx mending gak usah ikutan di pengantaran pelayanan sangat buruk pesan makanan  hari belum sampai alasannya alamat tidak lengkap padahal paket yg lain dengan alamat yg lain lgsg sampai tolong ekspedisi  kurir yg lelet diberi sanksi,ekspedisi spx mending gak ikutan pengantaran pelayanan buruk pesan makanan alasannya alamat lengkap paket yg alamat yg lgsg tolong ekspedisi kurir yg lelet sanksi,"['ekspedisi', 'spx', 'mending', 'gak', 'ikutan', 'pengantaran', 'pelayanan', 'buruk', 'pesan', 'makanan', 'alasannya', 'alamat', 'lengkap', 'paket', 'yg', 'alamat', 'yg', 'lgsg', 'tolong', 'ekspedisi', 'kurir', 'yg', 'lelet', 'sanksi']",ekspedisi spx mending gak ikut antar layan buruk pesan makan alas alamat lengkap paket yg alamat yg lgsg tolong ekspedisi kurir yg lelet sanksi
1,"Makin lama makin kecewa. Makin banyak update aplikasi jadi Lemot,Lag,ngefrezz dan juga suka keluar sendiri .. payahh kecewa.. kalo ada setengah bintang maka saya kasih setengah bintang",Negatif,makin lama makin kecewa makin banyak update aplikasi jadi lemotlagngefrezz dan juga suka keluar sendiri  payahh kecewa kalo ada setengah bintang maka saya kasih setengah bintang,kecewa update aplikasi lemotlagngefrezz suka payahh kecewa kalo bintang kasih bintang,"['kecewa', 'update', 'aplikasi', 'lemotlagngefrezz', 'suka', 'payahh', 'kecewa', 'kalo', 'bintang', 'kasih', 'bintang']",kecewa update aplikasi lemotlagngefrezz suka payahh kecewa kalo bintang kasih bintang
2,"Mohon maaf..Dulu lebih mudah berbelanja..bisa cod.menyenangkan dan lebih praktis. Sekarang mengecewakan pengiriman pake spx, telat respon karna lagi kerja eh dibalikin lagi paket ke penjual. Kenapa ya gak bisa diubah kyk sebelumnya, lebih bagus pake j&t, jne, dll. Tapi kalo spx duh mengecewakan, sorry ye",Negatif,mohon maafdulu lebih mudah berbelanjabisa codmenyenangkan dan lebih praktis sekarang mengecewakan pengiriman pake spx telat respon karna lagi kerja eh dibalikin lagi paket ke penjual kenapa ya gak bisa diubah kyk sebelumnya lebih bagus pake jt jne dll tapi kalo spx duh mengecewakan sorry ye,mohon maafdulu mudah berbelanjabisa codmenyenangkan praktis mengecewakan pengiriman pake spx telat respon karna kerja eh dibalikin paket penjual ya gak diubah kyk bagus pake jt jne dll kalo spx duh mengecewakan sorry ye,"['mohon', 'maafdulu', 'mudah', 'berbelanjabisa', 'codmenyenangkan', 'praktis', 'mengecewakan', 'pengiriman', 'pake', 'spx', 'telat', 'respon', 'karna', 'kerja', 'eh', 'dibalikin', 'paket', 'penjual', 'ya', 'gak', 'diubah', 'kyk', 'bagus', 'pake', 'jt', 'jne', 'dll', 'kalo', 'spx', 'duh', 'mengecewakan', 'sorry', 'ye']",mohon maafdulu mudah berbelanjabisa codmenyenangkan praktis kecewa kirim pake spx telat respon karna kerja eh dibalikin paket jual ya gak ubah kyk bagus pake jt jne dll kalo spx duh kecewa sorry ye
1,"Pas tiap buka aplikasi shopee sering keluar sendiri pas buka nya , padahal saya udah lama berlangganan dengan melalui shopee ini . tapi lemot banget , tidak ada perubahan tuk lancar buka aplikasi nya . sangat kecewaaaaaa",Negatif,pas tiap buka aplikasi shopee sering keluar sendiri pas buka nya  padahal saya udah lama berlangganan dengan melalui shopee ini  tapi lemot banget  tidak ada perubahan tuk lancar buka aplikasi nya  sangat kecewaaaaaa,pas buka aplikasi shopee pas buka nya udah berlangganan shopee lemot banget perubahan tuk lancar buka aplikasi nya kecewaaaaaa,"['pas', 'buka', 'aplikasi', 'shopee', 'pas', 'buka', 'nya', 'udah', 'berlangganan', 'shopee', 'lemot', 'banget', 'perubahan', 'tuk', 'lancar', 'buka', 'aplikasi', 'nya', 'kecewaaaaaa']",pas buka aplikasi shopee pas buka nya udah langgan shopee lot banget ubah tuk lancar buka aplikasi nya kecewaaaaaa
2,"Uang masuk saldo penjualnya jadi lama bgt;') ga kayak dlu cepet, padahal pembeli udh klik pesanan diterima, tapi uangnya harus nunggu 36jam buat masuk saldo penjual;') tolong di perbaiki min, soalnya buat penjual kecil butuh secepatnya buat modal lagi.",Negatif,uang masuk saldo penjualnya jadi lama bgt ga kayak dlu cepet padahal pembeli udh klik pesanan diterima tapi uangnya harus nunggu jam buat masuk saldo penjual tolong di perbaiki min soalnya buat penjual kecil butuh secepatnya buat modal lagi,uang masuk saldo penjualnya bgt ga kayak dlu cepet pembeli udh klik pesanan diterima uangnya nunggu jam masuk saldo penjual tolong perbaiki min penjual butuh secepatnya modal,"['uang', 'masuk', 'saldo', 'penjualnya', 'bgt', 'ga', 'kayak', 'dlu', 'cepet', 'pembeli', 'udh', 'klik', 'pesanan', 'diterima', 'uangnya', 'nunggu', 'jam', 'masuk', 'saldo', 'penjual', 'tolong', 'perbaiki', 'min', 'penjual', 'butuh', 'secepatnya', 'modal']",uang masuk saldo jual bgt ga kayak dlu cepet beli udh klik pesan terima uang nunggu jam masuk saldo jual tolong baik min jual butuh cepat modal
1,"Shopee tolong kalau mau tampil video²nya pisahin aplikasinya. Ini videonya udah kek Tik Tok dan Snack ga jelas dan ga bermanfaat. Hal ini juaga membuat aplikasi boros penggunaan data dan membuat pengalaman belanja sangat buruk. Notif bawah atas sering ke pencet dan pindah kemana-mana. Aplikasi jadi buruk dan lelet! Please jangan latah²an, ini marketplace profesional udah ke sosmed aja. 😒 Pas buka shopee malah dipaksa nonton live. Aplikasi vangsat.",Negatif,shopee tolong kalau mau tampil videonya pisahin aplikasinya ini videonya udah kek tik tok dan snack ga jelas dan ga bermanfaat hal ini juaga membuat aplikasi boros penggunaan data dan membuat pengalaman belanja sangat buruk notif bawah atas sering ke pencet dan pindah kemanamana aplikasi jadi buruk dan lelet please jangan latahan ini marketplace profesional udah ke sosmed aja  pas buka shopee malah dipaksa nonton live aplikasi vangsat,shopee tolong tampil videonya pisahin aplikasinya videonya udah kek tik tok snack ga ga bermanfaat juaga aplikasi boros penggunaan data pengalaman belanja buruk notif pencet pindah kemanamana aplikasi buruk lelet please latahan marketplace profesional udah sosmed aja pas buka shopee dipaksa nonton live aplikasi vangsat,"['shopee', 'tolong', 'tampil', 'videonya', 'pisahin', 'aplikasinya', 'videonya', 'udah', 'kek', 'tik', 'tok', 'snack', 'ga', 'ga', 'bermanfaat', 'juaga', 'aplikasi', 'boros', 'penggunaan', 'data', 'pengalaman', 'belanja', 'buruk', 'notif', 'pencet', 'pindah', 'kemanamana', 'aplikasi', 'buruk', 'lelet', 'please', 'latahan', 'marketplace', 'profesional', 'udah', 'sosmed', 'aja', 'pas', 'buka', 'shopee', 'dipaksa', 'nonton', 'live', 'aplikasi', 'vangsat']",shopee tolong tampil video pisahin aplikasi video udah kek tik tok snack ga ga manfaat juaga aplikasi boros guna data alam belanja buruk notif pencet pindah kemanamana aplikasi buruk lelet please latah marketplace profesional udah sosmed aja pas buka shopee paksa nonton live aplikasi vangsat
1,"Mau kasih bintang satu aja, soalnya kecewa dengan apa yg udah dibterapin sama Shopee, Shopee itu bagus, semua fitur-fitur lengkap, tapi dari sekian banyak fitur yg paling sulit itu membuka fitur bantuan dan live chat, sehingga sulit untuk mengadu kan semua nya 🙏🏼",Negatif,mau kasih bintang satu aja soalnya kecewa dengan apa yg udah dibterapin sama shopee shopee itu bagus semua fiturfitur lengkap tapi dari sekian banyak fitur yg paling sulit itu membuka fitur bantuan dan live chat sehingga sulit untuk mengadu kan semua nya ,kasih bintang aja kecewa yg udah dibterapin shopee shopee bagus fiturfitur lengkap sekian fitur yg sulit membuka fitur bantuan live chat sulit mengadu nya,"['kasih', 'bintang', 'aja', 'kecewa', 'yg', 'udah', 'dibterapin', 'shopee', 'shopee', 'bagus', 'fiturfitur', 'lengkap', 'sekian', 'fitur', 'yg', 'sulit', 'membuka', 'fitur', 'bantuan', 'live', 'chat', 'sulit', 'mengadu', 'nya']",kasih bintang aja kecewa yg udah dibterapin shopee shopee bagus fiturfitur lengkap sekian fitur yg sulit buka fitur bantu live chat sulit adu nya
5,"Saran untuk bagian penagihan spaylater dan juga spinjam, jangan seenaknya mengakses kontak orang lain lalu mengkontak mereka menginfokan bahwa seseorang mempunyai tagihan yg telah kelewat jatuh tempo. Pelanggaran privasi.",Positif,saran untuk bagian penagihan spaylater dan juga spinjam jangan seenaknya mengakses kontak orang lain lalu mengkontak mereka menginfokan bahwa seseorang mempunyai tagihan yg telah kelewat jatuh tempo pelanggaran privasi,saran penagihan spaylater spinjam mengakses kontak orang mengkontak menginfokan tagihan yg kelewat jatuh tempo pelanggaran privasi,"['saran', 'penagihan', 'spaylater', 'spinjam', 'mengakses', 'kontak', 'orang', 'mengkontak', 'menginfokan', 'tagihan', 'yg', 'kelewat', 'jatuh', 'tempo', 'pelanggaran', 'privasi']",saran tagih spaylater spinjam akses kontak orang kontak info tagih yg lewat jatuh tempo langgar privasi
2,"Aplikasi eror tidak bisa di buka kalo di tampilan awal selalu ada tulisan ""ada masalah silahkan muat ulang"" udah di muat ulang tetep aja ngga bisa tolong di PERBAIK ki secepat nya Shopee Mungkin kalo ngga ada gangguan begitu sangat membantu apk ini",Negatif,aplikasi eror tidak bisa di buka kalo di tampilan awal selalu ada tulisan ada masalah silahkan muat ulang udah di muat ulang tetep aja ngga bisa tolong di perbaik ki secepat nya shopee mungkin kalo ngga ada gangguan begitu sangat membantu apk ini,aplikasi eror buka kalo tampilan tulisan silahkan muat ulang udah muat ulang tetep aja ngga tolong perbaik ki secepat nya shopee kalo ngga gangguan membantu apk,"['aplikasi', 'eror', 'buka', 'kalo', 'tampilan', 'tulisan', 'silahkan', 'muat', 'ulang', 'udah', 'muat', 'ulang', 'tetep', 'aja', 'ngga', 'tolong', 'perbaik', 'ki', 'secepat', 'nya', 'shopee', 'kalo', 'ngga', 'gangguan', 'membantu', 'apk']",aplikasi eror buka kalo tampil tulis silah muat ulang udah muat ulang tetep aja ngga tolong baik ki cepat nya shopee kalo ngga ganggu bantu apk
1,tambah berat aplikasinya. sering ngelak. tombol kembali ndak respon. pertama kali buka aplikasi langsung masuk live. tambah berat. belanja jadi ndak nyaman. semakin banyak penipuan bermodus misteri box maupun sistem cod. semoga kedepan bisa segera di tertibkan,Negatif,tambah berat aplikasinya sering ngelak tombol kembali ndak respon pertama kali buka aplikasi langsung masuk live tambah berat belanja jadi ndak nyaman semakin banyak penipuan bermodus misteri box maupun sistem cod semoga kedepan bisa segera di tertibkan,berat aplikasinya ngelak tombol ndak respon kali buka aplikasi langsung masuk live berat belanja ndak nyaman penipuan bermodus misteri box sistem cod semoga kedepan tertibkan,"['berat', 'aplikasinya', 'ngelak', 'tombol', 'ndak', 'respon', 'kali', 'buka', 'aplikasi', 'langsung', 'masuk', 'live', 'berat', 'belanja', 'ndak', 'nyaman', 'penipuan', 'bermodus', 'misteri', 'box', 'sistem', 'cod', 'semoga', 'kedepan', 'tertibkan']",berat aplikasi ngelak tombol ndak respon kali buka aplikasi langsung masuk live berat belanja ndak nyaman tipu modus misteri box sistem cod moga depan tertib
